{
  "intent_id": "TI-20990101-synth1",
  "created_at": "2099-01-01T00:00:00+00:00",
  "mode": "paper",
  "broker": "ibkr",
  "symbol": "MES",
  "side": "BUY",
  "contracts": 1,
  "entry_type": "LIMIT",
  "limit_price": 100.0,
  "stop_price": 90.0,
  "target_price": 120.0,
  "max_loss_usd": 50.0,
  "thesis": "Synthetic paper-only example; not an authorization.",
  "invalidation": "Price loses VWAP reclaim level and closes below trigger.",
  "expires_at": "2099-06-05T14:00:00+00:00",
  "requires_human_approval": true,
  "human_approval": {
    "approved": true,
    "reviewer": "synthetic-reviewer",
    "decided_at": "2099-01-01T00:01:00+00:00"
  },
  "blocked_event_override": false
}
